{
  "industry": "快消/零售",
  "keywords": ["品牌", "营销", "渠道", "电商", "GMV", "转化率", "投放", "会员"],
  "skills": {
    "专业技能": ["用户增长分析", "电商运营", "投放策略"],
    "工具与框架": ["Excel", "SQL", "Power BI", "Tableau"],
    "语言": ["Python", "SQL"]
  },
  "metric_style": "GMV 提升 12%、转化率提升 1.8 个百分点、投放 ROI 达 3.2",
  "tone": "结果导向，突出业务指标与渠道理解",
  "notes": ["避免编造具体品牌合作；实习生强调活动支持与数据整理"],
  "project_types": ["用户增长分析", "电商投放复盘", "会员运营看板"]
}
