{
  "industry": "游戏",
  "keywords": ["游戏", "留存", "付费", "关卡", "匹配", "ARPU", "流失"],
  "skills": {
    "专业技能": ["游戏数据分析", "留存分析", "付费分析"],
    "工具与框架": ["Python", "SQL", "Looker", "Amplitude"],
    "语言": ["Python", "SQL"]
  },
  "metric_style": "次日留存提升 3 个百分点、ARPU 提升 12%、匹配时长降至 3 秒",
  "tone": "数据驱动，突出玩家洞察与增长实验",
  "notes": ["避免编造具体游戏项目名称；实习生强调分析支持与实验执行"],
  "project_types": ["玩家留存分析", "对战匹配优化", "付费转化漏斗"]
}
