{
  "industry": "制造/工业",
  "keywords": ["产线", "良率", "成本", "供应链", "精益", "OEE", "预测性维护"],
  "skills": {
    "专业技能": ["数据分析", "工业数据处理", "设备监控"],
    "工具与框架": ["Python", "SQL", "MES", "PLC 数据采集"],
    "语言": ["Python", "SQL"]
  },
  "metric_style": "良率提升 1.2%、单件成本下降 8%、设备 OEE 达 92%",
  "tone": "务实严谨，强调可靠性与现场落地",
  "notes": ["避免夸大工艺改进；量化以产线实测口径为准"],
  "project_types": ["良率分析", "设备预测性维护", "供应链需求预测"]
}
