{
  "industry": "金融",
  "keywords": ["风控", "合规", "反欺诈", "量化", "银行", "信贷", "监管", "AUC"],
  "skills": {
    "专业技能": ["数据分析", "风控建模", "量化分析"],
    "工具与框架": ["Python", "SQL", "SAS", "Tableau"],
    "语言": ["Python", "SQL"]
  },
  "metric_style": "坏账率降低 0.8%、审批效率提升 15%、模型 AUC 达 0.92",
  "tone": "严谨克制，强调合规意识与数据准确性",
  "notes": ["切勿夸大合规/风控经验；涉及监管指标用词务必保守；实习生强调学习与辅助贡献"],
  "project_types": ["风控特征分析", "信贷审批自动化", "数据看板"]
}
